Key;English;Spanish;German;Polish;French;Italian;Swedish;Czech;Hungarian;Dutch;Portuguese;Russian;Finnish;
japanese_unification_decision_desc;After decades of progressive loss of the power of the emperor, we can decide to make a civil war after the coronation of the new emperor Meiji, who will be the first true emperor in the history of Japan. We can finally kick the shoguns out of our mighty and prosperous nation...;x;
japanese_unification_decision_title;Overthrow the Bakufu;x;
annex_korea_title;Annex Korea;x;
annex_korea_desc;The Joseon Dynasty is close to our island territory, which has led us to create a plan to annex the Korean peninsula... The different countries around Korea do not agree with our expansion policy in Asia. That is why we must take a few precautions;x;
hokkaido_question_title;The Hokkaido Question;x;
hokkaido_question_desc;The local population of Hokkaido is not totally Japanese, this has led us to think about a possible reform in our cultural policies, since the only peoples accepted in our nation are those who have totally Japanese culture... This reform will make starting henceforth the ainu culture is also an accepted culture;x;
form_iberia_title;Form Iberia;x;
form_iberia_desc;The unification attempts between the two existing nations in the Iberian Peninsula have led us to think about a possible Iberian union, which would make the two countries stronger by uniting them into one. Making it a comparable union with countries like Germany, Russia, Austria, France... Glory to the new Iberian Union!;x;
the_iberian_lands_title;The Iberian Lands;x;
the_iberian_lands_desc;The Iberian Union was formed and to commemorate it, we can claim our territories throughout the peninsula and finally become a true union of the Iberian Peninsula, as we will recover our nuclei throughout our national territory... The different countries that occupy the territories, they will lose diplomatic relations with us.;x;
sign_the_oregon_treaty_title;Oregon Treaty;x;
sign_the_oregon_treaty_desc;In recent years, the Oregon region has been disputed between us and the United States of America. For this reason, as in previous treaties, we must define clear provinces in North America and of course get along with our friends the United States, once good borders will be defined...;x;
expedition_to_algeria_title;Expedition to Algeria;x;
expedition_to_algeria_desc;The African kingdom of Algeria has been a problem for us in our expansion through Africa, mainly due to its insane amount of mountains and rivers that impeded our advance... To compensate for that, we can send some settlers and we will see what happens with the future of the North African kingdom.;x;
colonize_algeria_title;Establish the Protectorate of Algeria;x;
colonize_algeria_desc;The African kingdom of Algeria has been a problem for us in our expansion through Africa, mainly due to its insane amount of mountains and rivers that impeded our advance... That is why, after sending our best settlers, we will be able to annex the kingdom that resisted us so much. has put in our imperialism for Africa...;x;
the_gabon_protectorate_title;The Gabon Protectorate;x;
the_gabon_protectorate_desc;Our various colonies in Africa have been very effective in raising money for the French state. For what has led us to think of a possible new settlement in the region of Gabon, in West Africa, this will leave us one step closer to a better colonization of the interior of the continent.;x;
unite_italy_title;Unite Italy;x;
unite_italy_desc;The Italian states, after many years, are in a single sphere of influence, ours, that once we have all their states under our control, we will be able to form the Pope's Italy, making Catholicism a great empire that will lead alongside ours, peace to the world... The papacy will thank us for this definitive union to give us Savoy and the city of Nice.;x;
claim_lombardia_title;Intervention in Lombardy;x;
claim_lombardia_desc;By establishing a dominant position on the Italian peninsula, we can secure a national homeland for our people by proclaiming ourselves the motive power of a unified Italian state. So, we can claim Lombardia to form the Kingdom of Italy;x;
the_papal_reforms_title;The Papal Reforms;x;
the_papal_reforms_desc;The unification of Italy by the French, and the leadership by the Pope of our country, has made it possible for us to carry out prestigious reforms that will help Italy's future as a power in the Mediterranean. We owe all this thanks to the mighty French empire, which has helped us unify. Three cheers for the Pope!;x;
the_saharan_lands_title;The Saharan Lands;x;
the_saharan_lands_desc;In the terms of the Africa Conference, we have so countries to colonize them, so after the fall of some african minors, we can expand our territory in africa, starting in our first protectorate, the most part of africa will be our soon...Our empire is a colonial nation again!;x;
claim_the_rif_title;Claim the Moroccan Al Rif;x;
claim_the_rif_desc;In the terms of the Africa Conference, we have so countries to colonize them, so after the fall of some african minors, we can expand our territory in africa, starting in our first protectorate, the most part of africa will be our soon...Our empire is a colonial nation again!;x;
claim_the_western_sahara_title;Claim Western Sahara territories;x;
claim_the_western_sahara_desc;In the terms of the Africa Conference, we have so countries to colonize them, so after the fall of some african minors, we can expand our territory in africa, starting in our first protectorate, the most part of africa will be our soon...Our empire is a colonial nation again!;x;
establish_the_moroccan_protectorate_title;Establish the Moroccan Protectorate;x;
establish_the_moroccan_protectorate_desc;In the terms of the Africa Conference, we have so countries to colonize them, so after the fall of some african minors, we can expand our territory in africa, starting in our first protectorate, the most part of africa will be our soon...Our empire is a colonial nation again!;x;
shanghai_treaty_port_title;Claim Shangai;x;
shanghai_treaty_port_desc;After the bloody war with China, we can negotiate an unequal treaty and claim a port of yours and put it under our legitimate domain... To do this, choose one of the port decisions, you can only claim one in each war, so choose well ...;x;
hong_kong_treaty_port_title;Claim Hong Kong;x;
hong_kong_treaty_port_desc;After the bloody war with China, we can negotiate an unequal treaty and claim a port of yours and put it under our legitimate domain... To do this, choose one of the port decisions, you can only claim one in each war, so choose well ...;x;
macao_treaty_port_title;Claim Macao;x;
macao_treaty_port_desc;After the bloody war with China, we can negotiate an unequal treaty and claim a port of yours and put it under our legitimate domain... To do this, choose one of the port decisions, you can only claim one in each war, so choose well ...;x;
qingdao_treaty_port_title;Claim Qingdao;x;
qingdao_treaty_port_desc;After the bloody war with China, we can negotiate an unequal treaty and claim a port of yours and put it under our legitimate domain... To do this, choose one of the port decisions, you can only claim one in each war, so choose well ...;x;
meihaiwei_treaty_port_title;Claim Meihaiwei;x;
meihaiwei_treaty_port_desc;After the bloody war with China, we can negotiate an unequal treaty and claim a port of yours and put it under our legitimate domain... To do this, choose one of the port decisions, you can only claim one in each war, so choose well ...;x;
taicangzhoug_treaty_port_title;Claim Meihaiwei;x;
taicangzhoug_treaty_port_desc;After the bloody war with China, we can negotiate an unequal treaty and claim a port of yours and put it under our legitimate domain... To do this, choose one of the port decisions, you can only claim one in each war, so choose well ...;x;
jiaxing_treaty_port_title;Claim Meihaiwei;x;
jiaxing_treaty_port_desc;After the bloody war with China, we can negotiate an unequal treaty and claim a port of yours and put it under our legitimate domain... To do this, choose one of the port decisions, you can only claim one in each war, so choose well ...;x;
hainan_treaty_port_title;Claim Meihaiwei;x;
hainan_treaty_port_desc;After the bloody war with China, we can negotiate an unequal treaty and claim a port of yours and put it under our legitimate domain... To do this, choose one of the port decisions, you can only claim one in each war, so choose well ...;x;
austrian_menace_title;The Austrian Menace;x;
austrian_menace_desc;For the past few decades, the Austrians have made it difficult for us to control the minority German states, so we must allay their concerns and give them a deserved defeat by demonstrating the capabilities of our mighty military and bringing down what they call an "army" that is not more than a bunch of ethnic groups together on the same side.;x;
holstein_integration_title;The Holstein Question;x;
holstein_integration_desc;The territory of Holstein has been questioned if it is German territory or not, the Prussians consider that Holstein should be a legitimate German territory, considering that it was in the territory of the now non-existent Holy Roman Empire.;x;
destroy_eiffel_tower_title;Destroy The Eiffel;x;
destroy_eiffel_tower_desc;We have recently occupied the capital of France, it has many historical elements like the eiffel tower, for that and to harm the French, we can destroy it since we have full control over it.;x;
montenegro_conquest_title;Conquer Montenegro;x;
montenegro_conquest_desc;The sovereign country of Montenegro has a legitimate owner, the Ottoman Empire, before the "Independence" of our territories at the hands of the Russian Empire left us weakened and very badly seen by the citizens of our old cities, it is time to restore order...;x;
serbian_conquest_title;Conquer Serbia;x;
serbian_conquest_desc;The sovereign country of Serbia has a legitimate owner, the Ottoman Empire, before the "Independence" of our territories at the hands of the Russian Empire left us weakened and very badly seen by the citizens of our old cities, it is time to restore order...;x;
annex_tunis_title;The Mediterranean Question;x;
annex_tunis_desc;Our vassals have recently rebelled against us, such as Egypt or Tripoli, which under our control, have raised their arms and have tried to become independent from us... For this reason, and as a precaution, we must annex the vassal of the Mediterranean, Tunisia.;x;
create_the_british_raj_title;Create The British Raj;x;
create_the_british_raj_desc;A long time ago, the English began to colonize the Indian land in the hope of finding and materializing our imperial needs, until now it has seemed good to us to leave India in our hands, but the stability of our empire could be greater if we created a vassal with civilian semi-control.;x;
claim_kongo_lands_title;Treaty of Mbanza;x;
claim_kongo_lands_desc;For a long time, our maritime power and the excellent Portuguese crew have been able to establish colonies in southern Africa, for this reason, and with the help of our African diplomats, we will try to reach an agreement with the Kingdom of Kongo;x;
treaty_of_saurimo_title;Treaty of Saurimo;x;
treaty_of_saurimo_desc;For a long time, our maritime power and the excellent Portuguese crew have been able to establish colonies in southern Africa, for this reason, and with the help of our African diplomats, we will try to reach an agreement with the Kingdom of Lunda;x;
expand_angola_colony_title;Expand Our Colony in Angola;x;
expand_angola_colony_desc;The constant pressures on the continent of Africa have led us to continue our expansion on the continent and for this reason we plan to expand the colony of Angola. In the future we will try to unite our two main colonies in Africa, Mozambique and Angola.;x;
claim_all_mozambique_lands_title;The Mozambiquan Lands;x;
claim_all_mozambique_lands_desc;The constant pressures on the continent of Africa have led us to continue our expansion on the continent and for this reason we plan to expand the colony of Mozambique. In the future we will try to unite our two main colonies in Africa, Mozambique and Angola.;x;
chaos_in_peru_bolivia_title;Chaos in the Confederation;x;
chaos_in_peru_bolivia_desc;The Confederation of Peru Bolivia is a chaos in the wars, the people in our country are hungry and we can stop this proclaiming our independence from the chaotic and horrible confederation, three hurras for the new state of Peru!;x;
restore_first_mexican_empire_title;Claim The First Mexican Empire;x;
restore_first_mexican_empire_desc;Since our independence from Spain, we have been unconcerned about territorial issues, first, the USCA (The United States of Central America) and now, we have received a statement from the USA and the Mexican territories of the north are demanding us, we have to make a move or they will eat us from all sides...;x;
establish_mexican_empire_title;Establish the Second Mexican Empire;x;
establish_mexican_empire_desc;Mexicans have always been a nation with a lot of potential and they have not known how to take advantage of it, therefore, we must revive the Empire of its former glory and turn the Mexican nation into an example for recent nations to follow.;x;
claim_savoy_title;Claim Savoy;x;
claim_savoy_desc;We can Claim Savoy from the Italians and become a influential superpower in the region this is our reward for the help that we gived to the Italian Unification, we supose that it will make angry the Italian People but we are more strong...;x;
claim_finland_title;Claim Finland;x;
claim_finland_desc;We Finns consider them a group of people similar to us and that long ago was one of our territories, that's why we can sue all the territories that now belong to a satellite of the Russian Empire...;x;
annex_finland_title;The Fate of Finland;x;
annex_finland_desc;Finland has been a state of our empire for a long time, so we have had to face the problems that Finland was bringing us for being a semi-free state, for this reason and to avoid problems in the future, we must end its autonomy...;x;
annex_transcaucasia_title;The Fate of Transcaucasia;x;
annex_transcaucasia_desc;Transcaucasia has been a state of our empire for a long time, so we have had to face the problems that Transcaucasia was bringing us for being a semi-free state, for this reason and to avoid problems in the future, we must end its autonomy, like with Finland...;x;
claim_kazakh_territories_title;Claim Kazakh Territories;x;
claim_kazakh_territories_desc;The Russian population in uncivilized territories must be returned to our territories and since they do not come, we will go for them, for this we will claim a series of territories in our sphere and we will obtain them by will or by force.;x;
expedition_to_rio_gallegos_title;Expedition to Rio de Gallegos;x;
expedition_to_rio_gallegos_desc;The Argentines have always wanted to claim part of southern Patagonia, but the Chileans have interrupted several times in our acquisitions, so it is time to step forward and found a new colony in the southern region to secure our position.;x;
the_patagonian_lands_title;Treaty with the Mapuche Tribe;x;
the_patagonian_lands_desc;The Mapuche people are inferior to us and we can make them sign a treaty without knowing what it means and take advantage of their innocence to win land from the Chileans in this race for Patagonia, long live Argentina!;x;
chilean_patagonia_title;Treaty with the Mapuches;x;
chilean_patagonia_desc;The Mapuche people are inferior to us and we can make them sign a treaty without knowing what it means and take advantage of their innocence to win land from the Argentines in this race for Patagonia, long live Chile!;x;
call_patagonian_convention_title;Call the Patagonian Convention;x;
call_patagonian_convention_desc;Since our independence from Spain, the borders have never been clear in the region of Patagonia and despite our efforts to resolve it diplomatically, it had not been possible until now, that is why we must assure our neighbors that we will create a fair treaty for the two countries...;x;
conquest_of_the_desert_title;Conquest of the Desert;x;
conquest_of_the_desert_desc;Recent research on various civilizational technologies of underdeveloped countries has led us to question whether we should occupy and annex the desert that separates our empire from the emirate of Nejd. Should we annex those lands or is it better that we leave them as a protection wall?;x;
rebelion_against_the_austrians_title;Rebel Against the Austrian Empire;x;
rebelion_against_the_austrians_desc;Since 1836, the austrian army has occupied the city of krakow and therefore our entire country, our big neighbor asks us to join his country or they will invade us, so we assume that it is a provocation for our duchy and therefore we must declare the war to Austria;x;
carlos_won_the_war_title;Carlism Won;x;
carlos_won_the_war_desc;After our victory in the Carlist wars we can honor our past and start reclaiming our old territories that recently belonged to the glorious Spanish Empire and we must fulfill our debt to our followers of Carlism and therefore to Spain... The different countries that now "exist" in the ancient territory of Spain must be reconquered immediately without leaving a single province in the way...;x;
the_viceroyalty_of_nsp_title;The Viceroyalty of New Spain;x;
the_viceroyalty_of_nsp_desc;As good Spanish patriots, we have to restore the Spanish empire in parts, previously we have restored order in Spain and we have put an end to the suppression of all the officials who wanted to put an end to the monarchy and therefore to Spain... Our duty is to restore order in Latin America.;x;
the_viceroyalty_of_vng_title;The Viceroyalty of New Granada;x;
the_viceroyalty_of_vng_desc;As good Spanish patriots, we have to restore the Spanish empire in parts, previously we have restored order in Spain and we have put an end to the suppression of all the officials who wanted to put an end to the monarchy and therefore to Spain... Our duty is to restore order in Latin America.;x;
the_viceroyalty_of_vdp_title;The Viceroyalty of Peru;x;
the_viceroyalty_of_vdp_desc;As good Spanish patriots, we have to restore the Spanish empire in parts, previously we have restored order in Spain and we have put an end to the suppression of all the officials who wanted to put an end to the monarchy and therefore to Spain... Our duty is to restore order in Latin America.;x;
the_viceroyalty_of_vrp_title;The Viceroyalty of Rio de la Plata;x;
the_viceroyalty_of_vrp_desc;As good Spanish patriots, we have to restore the Spanish empire in parts, previously we have restored order in Spain and we have put an end to the suppression of all the officials who wanted to put an end to the monarchy and therefore to Spain... Our duty is to restore order in Latin America.;x;
form_argentina_title;Proclaim the Republic of Argentina;x;
form_argentina_desc;Since our independence from Spain, we have been involved in many wars for our independence that fragmented the old viceroyalty of silver, so we must continue trying to unify our lands, but for now we have to unify the Argentine nation under our command...;x;
zanzibar_expedition_title;Zanzibar Expidition;x;
zanzibar_expedition_desc;With the constant pressure from the European powers, we can ensure a strategic position for our country by establishing a colony in the uncivilized country of Zanzibar and thus be able to continue our colonial career in Africa together with the other great powers...;x;
the_live_in_the_new_world_title;The Live in The New World;x;
the_live_in_the_new_world_desc;Since the arrival of our people to our current land, the people here have gone through hard times that would not have happened in other places, wars, dictatorships, impoverishment of the population, etc... We have reached a fullness in terms of reforms policies and we have to attract immigrants, since it is the destiny of the country;x;
occupy_corrientes_title;Occupy Corrientes;x;
occupy_corrientes_desc;Throughout our brief history since our independence from Spain, we have secured all the provinces of our culture, but we can expand our borders into "Argentine" territory, since it is going through not very good times...;x;
the_fate_of_uruguay_title;The Fate of Uruguay;x;
the_fate_of_uruguay_desc;For a long time, the territory of Uruguay has been close to our borders, although it belonged to the Spanish Empire, but even so, it has a culture similar to ours, which means that its people can adapt to speaking Brazilian.;x;
conquest_chaco_region_title;Our Claims in the Chaco;x;
conquest_chaco_region_desc;The Chaco region has always been a question mark for the countries that surround it since we have never reached an agreement in which we can solve this problem... So we have to occupy our rightful territories and see if anyone wants to collaborate in the partition.;x;
the_lybian_claims_title;The Libyan Claims;x;
the_lybian_claims_desc;Since our unification we have wanted to make our nation a great country and that is why we have sought to expand our territories overseas, a nearby and easy to get territory would be the libya region that has been controlled by the Ottomans for a long time;x;
appoint_otto_von_bismark_title;Appoint Otto Von Bismarck;x;
appoint_otto_von_bismark_desc;A great nation needs a great leader who always supports the Kaiser, we have found some people who would meet the requirements but especially a man named Otto Von Bismarck we have found great charisma and a good mind for the next strategies, it is your decision bet or not on him...;x;
luxembourg_integration_title;Luxembourg is German;x;
luxembourg_integration_desc;The German peoples must all be united as a large people, not long ago, we have unified together with our brothers and we have achieved a semi-unification since we are still missing 1 German state, Luxembourg, that is why we must integrate it as well as the other german countries;x;
centralize_kurdish_states_title;Centralize Kurdish States;x;
centralize_kurdish_states_desc;Our Empire has conquered many territories that have gradually been in constant rebellions that have done nothing more than worsen the delicate situation of the empire, that is why we must establish an authoritarian regime in the Kurdish states to avoid a possible rebellion in the future;x;
kuwait_is_ottoman_title;The Fate of Kuwait;x;
kuwait_is_ottoman_desc;Our empire became one of the largest and most prestigious in the world and that is why we have to continue expanding this time towards Kuwait, an uncivilized nation in the south of the Middle East... We must sphere this small country to annex it;x;
establish_the_spanish_empire_title;Become The Spanish Empire;x;
establish_the_spanish_empire_desc;Over the last few years we have been able to experience a great growth of our territory at the hands of the new absolutist government that Carlos implemented after winning the Elizabethans in the Carlist wars... Now we can finally proclaim the New Spanish Empire!;x;
form_the_polar_empire_title;Form the Polar Empire;x;
form_the_polar_empire_desc;The polar bears have always been a very important faction in our territory, in such a way that we have included these adorable animals in our flag for a long time, that is why we must honor them even more for their work in our nation and transform us into an empire at last;x;
promote_the_monarchy_title;Promote The Monarchy;x;
promote_the_monarchy_desc;Make a Monarchy propaganda to transform $COUNTRY$ in a Absolute Monarchy, if you take this decision, you'll take the first option of the event tah will fire in 100 days, if you take the second option, $COUNTRY$ will lose 5 of prestige and the event will fire again in another 100 days;x;
improve_worker_conditions_decision_title;Improve the Worker Conditions;x;
improve_worker_conditions_decision_desc;Since the existence of factories in the Russian Empire, workers have been forced to work in harsh and painful conditions that have led to constant revolts against this decision. For this reason and carrying out small reforms in the current system, we will create a much more balanced society for our People.;x;
show_options_decisions_GPM_title;Show Options Decisions;x;
show_options_decisions_GPM_desc;Show the GPM extra decisions to improve the GPM gameplay's experience. There are a list of cheats!;
annex_all_vassals_option_title;Annex All our Vassals;x;
annex_all_vassals_option_desc;This decision annex all your vassals, NOT substates, the decision is considered a game cheat;x;
annex_all_substates_option_title;Annex All our Substates;x;
annex_all_substates_option_desc;This decision annex all your substates, NOT vassals, the decision is considered a game cheat;x;
remove_all_infamy_title;Remove All Infamy;x;
remove_all_infamy_desc;This decision removes all infamy of your country, this decision is considered a game cheat;x;
hide_options_decisions_GPM_title;Hide Options Decisions;x;
hide_options_decisions_GPM_desc;Hide the GPM extra decisions of gameplay's improvement. (The cheat decisions of the mod);x;
the_opium_in_china_title;Opium in The Qing Empire;x;
the_opium_in_china_desc;For a long time the Chinese have made it difficult for us to trade with them in such a way that it costs us more and more to buy their products and it costs them less to buy English products, that way, they would be winning and we should not allow an uncivilized country to do this.;x;
form_north_italy_title;Form North Italy;x;
form_north_italy_desc;The Italian countries were separated in the congress of Vienna and our mission is to make a cultural union in the italian peninsula, with this union of the north italian countries we can figure a dominant position in the region... Three hurras for Italy!;x;
form_south_italy_title;Form South Italy;x;
