Key;English;Spanish;German;Polish;French;Italian;Swedish;Czech;Hungarian;Dutch;Portuguese;Russian;Finnish;
form_south_italy_desc;The Italian countries were separated in the congress of Vienna and our mission is to make a cultural union in the italian peninsula, with this union of the south italian countries we can figure a dominant position in the region... Three hurras for Italy!;x;
secure_spanish_africa_title;Secure Ceuta & Melilla;x;
secure_spanish_africa_desc;For many years, the regions of Ceuta and Melilla have been Spanish and Catholic territory, so once and for all we must remove the trace of the Moroccans and Arabs who settled here in Spain during all these decades. The Moroccan government will probably find out about this cleanup, so our relations with them could worsen significantly...;x;
unify_romania_for_all_title;Unify Romania as Puppet;x;
unify_romania_for_all_desc;Romania has always been one of the most disputed territories in recent years and with our country firmly dominating the region we can unify the great country of Romania. As long as we have the countries that compose it in our sphere of influence...;x;
bosnian_integration_title;Bosnian Integration;x;
bosnian_integration_desc;In the last decade, the ottoman empire was falling into the black hole of the sick man of europe. With this active we can expand our empire in Bosnia, a region in the south of our country with serb and bosnian population. So lets annex the country for our great country!;x;
secure_qajar_dynasty_title;Secure The Qajar Dinasty;x;
secure_qajar_dynasty_desc;Through the years, the Persian Empire, better known as the Qajars, has been able to establish a dominant position over the Middle East, so we must assure the dynasty that has brought our country to glory. We must protect the Qajar dynasty!;x;
end_autonomy_of_ardalan_title;End Ardalan's Autonomy;x;
end_autonomy_of_ardalan_desc;Our country is one of the most powerful in the area, so it should not depend on other microstates in the area, such as small autonomies such as ardalan, jelali, among others. We must ensure the autonomy of the empire, not of the microstates;x;
end_autonomy_of_jelali_title;End Jelali's Autonomy;x;
end_autonomy_of_jelali_desc;Our country is one of the most powerful in the area, so it should not depend on other microstates in the area, such as small autonomies such as ardalan, jelali, among others. We must ensure the autonomy of the empire, not of the microstates;x;
end_autonomy_of_shakak_title;End Shakak's Autonomy;x;
end_autonomy_of_shakak_desc;Our country is one of the most powerful in the area, so it should not depend on other microstates in the area, such as small autonomies such as ardalan, jelali, among others. We must ensure the autonomy of the empire, not of the microstates;x;
demand_neuchatel_swi_title;Demand Neuchatel;x;
demand_neuchatel_swi_desc;The formation of the little country of neuchatel was a key point to destroy the german dynasty in Switzerland, now the things changed and germany is in way to form itself and our timer is near to 0 to unify the two countries of our land, neuchatel is our last objective;x;
unify_japan_as_shogun_title;Unify Shogunate Japan;x;
unify_japan_as_shogun_desc;After decades of progressive loss of the power of the shogun, we can decide to unify the nation after the coronation of the new Shogun, who will be the first true shogun in the history of The Shogunate Japan. We can finally kick the imperialism out of our mighty and prosperous nation...;x;
shogun_power_title;The Shogun Power;x;
shogun_power_desc;Our union of daimyos makes our nation quite divided, some with emperor and others with shogun, our mission is to establish a new shogun order on the entire island of Japan, long live the shogun!;x;
hold_guanxi_congress_title;Hold The Guangxi Congress;x;
hold_guanxi_congress_desc;The constant threats against our coalition government from all the Chinese states led by us mainly have caused great instability in the Qing empire, which has forced us to organize a congress to mediate with the situation, the chosen place in Guangxi, a  among all the members of the alliance;x;
meiji_constitution_title;Create The Meiji Constitution;x;
meiji_constitution_desc;After our unification we need a strong union among all the people of Japan. Most ask for the reconciliation of the shogun and emperor but we think that the best thing would be to create a constitution for our entire nation based, of course, on our principles of the Japanese Empire...;x;
abolish_han_system_title;Abolish The Han System;x;
abolish_han_system_desc;For decades, being separated into different Japanese substates, we decided that the way to manage the territory was through the Han System, invented by the Chinese. Now, once unified, we must change this system for a more efficient one: The Tok Sistem.;x;
accept_cristianity_title;Accept the Christianity in Japan;x;
accept_cristianity_desc;Long time ago, the shoguns prohibited Christianity in the old Shogunate, which originated a series of revolts and political instability that has led to worsening relations with the Christian countries of the world, especially the European ones. This does not interest us so we must remove the law of prohibition from Christianity.;x;
jakarta_convention_title;The Jakarta Convention;x;
jakarta_convention_desc;Our expeditions reached the Indonesian islands a long time ago, so through treaties with them we have subjected them to our domain. Now, we need to continue making treaties, we have proposed the "Jakarta" treaty, which proposes the annexation of several western states in Indonesia.;x;
makassar_convention_title;The Makassar Convention;x;
makassar_convention_desc;Our expeditions reached the Indonesian islands a long time ago, so through treaties with them we have subjected them to our domain. Now, we need to continue making treaties like the jakkarta one, now we have proposed the "Makassar" treaty, which proposes the annexation of several eastern states in Indonesia.;x;
form_pontifical_italy_title;Proclaim Papal Italy;x;
form_pontifical_italy_desc;By establishing a dominant position on the Italian peninsula, we can secure a national homeland for our people by proclaiming ourselves the motive power of a unified Italian state.;x;
change_capital_tokio_title;Tokio Promise;
change_capital_tokio_desc;The city of Tokio always was a very important city of our country, after our unification, we need to establish the capital in an important city, we consider that Tokio is a good place, you decide.;x;
sign_peking_treaty_title;Sign The Beijing Treaty;x;
sign_peking_treaty_desc;The Chinese can give us an isolated territory in the eastern part of the country, so we must demand the territory as soon as possible and not miss the opportunity. The different consequences that could appear would not directly affect us, so it is safe to make this important decision.;x;
sign_peking_treaty_by_force_title;Sign The Beijing Treaty by Force;x;
sign_peking_treaty_by_force_desc;The Chinese can give us an isolated territory in the eastern part of the country, so we must demand the territory as soon as possible and not miss the opportunity. The different consequences that could appear would not directly affect us, so it is safe to make this important decision.;x;
purpose_danubian_confederation_title;Purpose The Danubian Federation;x;
purpose_danubian_confederation_desc;The different governors of Austria and Hungary have always wanted to carry out a respectful unification with the two countries and with the other members of the empire. That is why this option of unifying the empire under the Danubian confederation can be carried out...;x;
french_cultures_school_title;French National Schools;x;
french_cultures_school_desc;The incredible increase in tensions with the different cultures in our territory has led to several internal conflicts that we must resolve immediately. We have checked the odds and can create national schools across the country to educate minority cultures.;x;
the_moret_law_title;The Moret Law;x;
the_moret_law_desc;With the constant pressures of the USA in Cuba and our other colonies, we cannot maintain the complete unity of our overseas territories, or at least as we manage the territory now. We have thought of prohibiting slavery, although this could worsen the default of Spaniards who own slaves.;x;
the_ottoman_tea_title;The Ottoman Tea;x;
the_ottoman_tea_desc;The power of the United Kingdom has challenged our tea production in our territory, so we must show them that we can also challenge their production.;x;รง
renovate_amsterdam_title;Renovate Amsterdam;x;
renovate_amsterdam_desc;The city of Amsterdam is already outdated for its time and we must invest in our capital and reform the most iconic buildings. Our architects forecast spending $100,000 on actual renovations, discounting of course the incredible contribution from our best investors, who will make a $5,000,000 cash payment to the Dutch bank.;x;
form_galitzia_lodomeria_title;Form Galitzia Lodomeria;x;
form_galitzia_lodomeria_desc;The Austrians long ago destroyed what was once the Galician Lodomeria region, now we can obtain those territories and form again that country so longed for by the local inhabitants...;x;
claim_eritrea_sfa_title;Claim Eritrea;x;
claim_eritrea_sfa_desc;The constant expansions of all the Europeans in Africa have not led to the thought of a colony in the Horn of Africa. The English and French are also interested in the same place, but we have reached an agreement between all of us and we can claim part of the territory that belongs to us.;x;
the_canadian_question_title;The Canadian Question;x;
the_canadian_question_desc;The constant Canadian provocations on our semi-independent territory are unable to withstand for our bureaucracy. Now that our country is stronger than ever, we must subdue the Canadian people once and for all in our empire.;x;
presa_di_roma_title;Presa di Roma;x;
presa_di_roma_desc;After the unification of most of the Italian states on the peninsula, we focus on a small state in the heart of the country: The Papal States, the incredible efforts to annex this country without success are too many to leave the mission behind now. We must intervene diplomatically and show France that we continue to claim the city of Rome regardless of its owner.;x;
the_peasant_reform_title;Approve The Peasant Reform;x;
the_peasant_reform_desc;The Russians are already tired of this mismanagement of the people's food and raw materials. The need for a reform is almost imminent and we must do it as soon as possible, otherwise, there could be a massive rebellion in the territories of the Russian Empire, they could even overthrow the current king!;x;
ethnic_cleansing_dictator_decision_title;Ethnic Cleansing;x;
ethnic_cleansing_dictator_decision_desc;In our territories there are a lot of people that aren't in our accepted cultures list, so we need a cleanup of all this people, but with an agressive method, the dead...;x;
renovate_vienna_title;Renovate Vienna;x;
renovate_vienna_desc;Since our coming to power of the Holy Roman Empire, we have not had sufficient economic capacity to develop the potential of our capital, Vienna. Now, we can invest in this great city and make it one of the most recognized in Europe.;x;
form_poland_title;Form Poland;x;
form_poland_desc;The Polish people have always found it difficult to be united with a single European country. Since the fall of the Commonwealth, we have been completely surrounded by Russians, Germans and Czechs. We must solve this as soon as possible and unite Poland.;x;
organize_canada_title;Organize Canada;x;
organize_canada_desc;Our country has many overseas territories, which is why we must create substates to offer adequate protection to the populations of those territories. One of the most important domains of our colonial empire is Canada, and it is the first that we should organize...;x;
organize_algeria_title;Organize Algeria;x;
organize_algeria_desc;Our country has many overseas territories, which is why we must create organized territories to offer adequate protection to the populations of those territories. One of the most important domains of our colonial empire is Algeria, and we should organize it...;x;
create_budapest_title;Create Budapest;x;
create_budapest_desc;The Hungarians of our territory have requested that we create a "capital" for their culture, they have proposed the city of "Pest", which is a good option due to its geographical location on the map of Hungary. In order not to anger a large part of the population, we must found the city before they provoke a massive rebellion.;x;
form_yugoslavia_title;Form Yugoslavia;x;
form_yugoslavia_desc;Our dominant position over our cultural union, allows us to form Yugoslavia through annexation or influence to neighboring countries and territories, it is our mission to unify this long-awaited country for our population...;x;
RSF_communist_moscow_title;The Communist Moscow;x;
RSF_communist_moscow_desc;Our country is being attacked by the Russian Empire and our mission is to defense communist people moving our current capital to Moscow;x;
RSF_civil_war_is_over_title;Russian Civil War is over;x;
RSF_civil_war_is_over_desc;Our destiny is the unification of all of Russia, we need the support of the population and the government, long live communist Russia!;x;
the_potato_decrees_title;The Potato Decrees;x;
the_potato_decrees_desc;The Russian serfs have been growing their own crops while most of the people who are not farmers want other crops like potatoes. For this reason, the large groups in Russia have proposed a reform in which for a period of time, farmers are forced to grow, eat and use potatoes in their crops, while the Russian high command enjoy other crops...;x;
claim_the_adriatic_title;Conquest of the Adriatic;x;
claim_the_adriatic_desc;After the claims in Venice, the Italians of the Adriatic claim their Italian, not Austrian, nationality. We must please them as soon as possible for the safety of these people, since they could rebel and the Austrian Empire could take action against them...;x;
mexican_manifiest_destinity_title;Mexican Manifest Destinity;x;
mexican_manifiest_destinity_desc;The United States are weak for economic and military reasons, we must take this opportunity to reclaim much of your country for our freedom and right of our nation. Our managers have discovered plans very similar to these but in the opposite way, so what we have done has been to reverse them in our favor.;x;
treaty_of_rio_de_janeiro_title;Treaty of Rio de Janeiro;x;
treaty_of_rio_de_janeiro_desc;The nation of Brazil has always had great ambitions to occupy most of the Amazonas in the name of the emperor. The Colombians still have a part of this great forest left, so we do not expect much resistance. Long live the Brazilian Empire!;x;
restore_brazil_protectorate_title;Restore The Brazilian Protectorate;x;
restore_brazil_protectorate_desc;Brazil has been one of our objectives since we changed the country's government. We can take it back and make it again a great Portuguese protectorate of great prestige...;x;
reform_peru_bolivia_title;Reunify Peru-Bolivia;x;
reform_peru_bolivia_desc;Since the fall of the old Peru-Bolivian confederation there have been several nationalist groups in our nation that have wanted to reunify this country again. For this reason and for the glory of the Confederacy, we must restore this union as soon as possible.;x;
reclaim_byzantine_territories_title;Reclaim the Ancient Byzantine Territories;x;
reclaim_byzantine_territories_desc;After the restoration of the Byzantine Empire, we can start our last move against our enemy the Ottoman Empire. It consists of reclaiming all the cores that once belonged to this glorious empire that was once the heir to Rome... Glory to the Byzantine Empire!;x;
refuse_usa_destinity_title;Refuse American Manifest Destinity;x;
refuse_usa_destinity_desc;The americans claimed all our northern territories and we can't allow that, with the recent war with them, they defeated and we now refuse to the paper of the "treaty" with us. Long life Mexico!;x;
expand_liberia_territories_title;Expand The Liberty;x;
expand_liberia_territories_desc;After the Berlin conference held by the European powers, the United States influenced them to give us some territories near our borders to improve American influence in Africa... Furthermore, the great powers agreed on this proposal and now we can claim what agreed.;x;
chinese_unification_title;Unify China;x;
chinese_unification_desc;For a long time, the different Chinese peoples have been at odds with each other, fighting senseless wars claiming territories from the Chinese population... Now that we have conquered all the remaining Chinese towns, we can finish the unification of the country by reorganizing the administration of the states Chinese that we control.;x;
conquer_hokkaido_island_title;Conquer Kita Ezo;x;
conquer_hokkaido_island_desc;After our complete unification, we can expand our national territory occupying the Hokkaido Island and incorporating it into our great nation, that island is a Japanese rightful territory. This will increase tensions with the Russian Empire and could lead to war in the future.;x;
sign_st_petersburg_treaty_title;Sign St. Petersburg Treaty;x;
sign_st_petersburg_treaty_desc;The recent Japanese unification has caused tensions to increase between both countries. The best decision we can make is to agree to a treaty by which we will occupy the north of Kita Ezo and the Japanese will occupy the south of it. Our diplomats agree with this treaty so it is the only thing we can do to end tensions...;x;
centralize_peru_bolivia_title;Centralize The Confederation;x;
centralize_peru_bolivia_desc;The states of the confederation have caused various problems to the central power of the nation and our advisors have recommended us to carry out a centralization process for the region of Peru... The unification process will require an immediate war only with South Peru, since the northern region will be occupied without much resistance thanks to the governor, who is in favor of this decision...;x;
form_tukulor_empire_title;Form The Tukulor Empire;x;
form_tukulor_empire_desc;The african nations also have union nations to form and be stronger, the problem are the so-called "civilized nations" that want to make us a protectorate, for this reason, we need to unite west african countries in one and better nation: The Tukulor Empire;x;
force_treaty_of_guadalupe_hidalgo_title;Force The Signing of the Treaty of Guadalupe Hidalgo;x;
force_treaty_of_guadalupe_hidalgo_desc;After the defeat of Mexico in the so-called "American-Mexican War", we can force the Mexican government to hand over all the territories corresponding to the manifest destiny that makes our nation stand out against other unimportant powers... This is the case of Mexico.;x;
form_ethiopia_title;Unify Ethiopia;x;
form_ethiopia_desc;The Ethiopian kingdoms have been divided for many years. Now, as brothers, we must unify the nation to restore the glory of our people... The difficulties that are presented to us should not prevent us from restoring the glory of our nation.;x;
GER_french_border_treaty_title;French-German Border Treaty;x;
GER_french_border_treaty_desc;After the last war with the French, our government has considered the possibility of restoring the previously agreed borders for the German formation. These possessions were limited to the region of Alsace-Lorraine, so if we sign this agreement, the other territories will become French again and France will lose its claims in this region...;x;
found_niger_company_title;Found The $COUNTRY_ADJ$ Niger Company;x;
found_niger_company_desc;Since recent years, the colonizers $COUNTRY_ADJ$ have been increasingly interested in founding a company to manage the resources in the south of the uncivilized country of Sokoto. However, other European powers also want this region rich in natural resources, so we must hurry to make a treaty with the local tribes...;x;
organize_libya_title;Organize Lybia;x;
organize_libya_desc;After the recent conquest of Libya, we can now organize the colony to establish cores of civilized countries in the territory and remove the unnecessary uncivilized countries that previously inhabited these lands... \n \n We must not forget that this decision is recommended by the organization of the entire continent...;x;
organize_egypt_title;Organize Egypt;x;
organize_egypt_desc;After the recent conquest of Egypt, we can now organize the colony to establish cores of civilized countries in the territory and remove the unnecessary uncivilized countries that previously inhabited these lands... \n \n We must not forget that this decision is recommended by the organization of the entire continent...;x;
organize_mauritania_title;Organize Mauritania;x;
organize_mauritania_desc;After the recent conquest of Mauritania, we can now organize the colony to establish cores of civilized countries in the territory and remove the unnecessary uncivilized countries that previously inhabited these lands... \n \n We must not forget that this decision is recommended by the organization of the entire continent...;x;
organize_gambia_and_senegal_title;Organize Gambia & Senegal;x;
organize_gambia_and_senegal_desc;After the recent conquest of Gambia & Senegal, we can now organize the colony to establish cores of civilized countries in the territory and remove the unnecessary uncivilized countries that previously inhabited these lands... \n \n We must not forget that this decision is recommended by the organization of the entire continent...;x;
organize_guinea_title;Organize Guinea;x;
organize_guinea_desc;After the recent conquest of Guinea, we can now organize the colony to establish cores of civilized countries in the territory and remove the unnecessary uncivilized countries that previously inhabited these lands... \n \n We must not forget that this decision is recommended by the organization of the entire continent...;x;
organize_sierra_leone_title;Organize Sierra Leone;x;
organize_sierra_leone_desc;After the recent conquest of Sierra Leone, we can now organize the colony to establish cores of civilized countries in the territory and remove the unnecessary uncivilized countries that previously inhabited these lands... \n \n We must not forget that this decision is recommended by the organization of the entire continent...;x;
organize_mali_title;Organize Mali;x;
organize_mali_desc;After the recent conquest of Mali, we can now organize the colony to establish cores of civilized countries in the territory and remove the unnecessary uncivilized countries that previously inhabited these lands... \n \n We must not forget that this decision is recommended by the organization of the entire continent...;x;
organize_ghana_title;Organize Ghana;x;
organize_ghana_desc;After the recent conquest of Ghana, we can now organize the colony to establish cores of civilized countries in the territory and remove the unnecessary uncivilized countries that previously inhabited these lands... \n \n We must not forget that this decision is recommended by the organization of the entire continent...;x;
organize_togo_and_dahomey_title;Organize Togo & Dahomey;x;
organize_togo_and_dahomey_desc;After the recent conquest of Togo & Dahomey, we can now organize the colony to establish cores of civilized countries in the territory and remove the unnecessary uncivilized countries that previously inhabited these lands... \n \n We must not forget that this decision is recommended by the organization of the entire continent...;x;
organize_niger_title;Organize Niger;x;
organize_niger_desc;After the recent conquest of Niger, we can now organize the colony to establish cores of civilized countries in the territory and remove the unnecessary uncivilized countries that previously inhabited these lands... \n \n We must not forget that this decision is recommended by the organization of the entire continent...;x;
organize_nigeria_title;Organize Nigeria;x;
organize_nigeria_desc;After the recent conquest of Nigeria, we can now organize the colony to establish cores of civilized countries in the territory and remove the unnecessary uncivilized countries that previously inhabited these lands... \n \n We must not forget that this decision is recommended by the organization of the entire continent...;x;
organize_chad_title;Organize Chad;x;
organize_chad_desc;After the recent conquest of Chad, we can now organize the colony to establish cores of civilized countries in the territory and remove the unnecessary uncivilized countries that previously inhabited these lands... \n \n We must not forget that this decision is recommended by the organization of the entire continent...;x;
organize_central_africa_title;Organize Central Africa;x;
organize_central_africa_desc;After the recent conquest of Central Africa, we can now organize the colony to establish cores of civilized countries in the territory and remove the unnecessary uncivilized countries that previously inhabited these lands... \n \n We must not forget that this decision is recommended by the organization of the entire continent...;x;
organize_gabon_title;Organize Gabon;x;
organize_gabon_desc;After the recent conquest of Gabon, we can now organize the colony to establish cores of civilized countries in the territory and remove the unnecessary uncivilized countries that previously inhabited these lands... \n \n We must not forget that this decision is recommended by the organization of the entire continent...;x;
organize_the_congo_title;Organize The Congo;x;
