Key;English;Spanish;German;Polish;French;Italian;Swedish;Czech;Hungarian;Dutch;Portuguese;Russian;Finnish;
organize_the_congo_desc;After the recent conquest of The Congo, we can now organize the colony to establish cores of civilized countries in the territory and remove the unnecessary uncivilized countries that previously inhabited these lands... \n \n We must not forget that this decision is recommended by the organization of the entire continent...;x;
organize_bas_congo_title;Organize Bas-Congo;x;
organize_bas_congo_desc;After the recent conquest of Bas-Congo, we can now organize the colony to establish cores of civilized countries in the territory and remove the unnecessary uncivilized countries that previously inhabited these lands... \n \n We must not forget that this decision is recommended by the organization of the entire continent...;x;
organize_eritrea_title;Organize Eritrea;x;
organize_eritrea_desc;After the recent conquest of Eritrea, we can now organize the colony to establish cores of civilized countries in the territory and remove the unnecessary uncivilized countries that previously inhabited these lands... \n \n We must not forget that this decision is recommended by the organization of the entire continent...;x;
organize_somalia_title;Organize Somalia;x;
organize_somalia_desc;After the recent conquest of Somalia, we can now organize the colony to establish cores of civilized countries in the territory and remove the unnecessary uncivilized countries that previously inhabited these lands... \n \n We must not forget that this decision is recommended by the organization of the entire continent...;x;
organize_kenya_title;Organize Kenya;x;
organize_kenya_desc;After the recent conquest of Kenya, we can now organize the colony to establish cores of civilized countries in the territory and remove the unnecessary uncivilized countries that previously inhabited these lands... \n \n We must not forget that this decision is recommended by the organization of the entire continent...;x;
organize_angola_title;Organize Angola;x;
organize_angola_desc;After the recent conquest of Angola, we can now organize the colony to establish cores of civilized countries in the territory and remove the unnecessary uncivilized countries that previously inhabited these lands... \n \n We must not forget that this decision is recommended by the organization of the entire continent...;x;
organize_zambia_and_malawi_title;Organize Zambia & Malawi;x;
organize_zambia_and_malawi_desc;After the recent conquest of Zambia & Malawi, we can now organize the colony to establish cores of civilized countries in the territory and remove the unnecessary uncivilized countries that previously inhabited these lands... \n \n We must not forget that this decision is recommended by the organization of the entire continent...;x;
organize_tanzania_title;Organize Tanzania;x;
organize_tanzania_desc;After the recent conquest of Tanzania, we can now organize the colony to establish cores of civilized countries in the territory and remove the unnecessary uncivilized countries that previously inhabited these lands... \n \n We must not forget that this decision is recommended by the organization of the entire continent...;x;
organize_namibia_title;Organize Namibia;x;
organize_namibia_desc;After the recent conquest of Namibia, we can now organize the colony to establish cores of civilized countries in the territory and remove the unnecessary uncivilized countries that previously inhabited these lands... \n \n We must not forget that this decision is recommended by the organization of the entire continent...;x;
organize_botswana_and_zimbabwe_title;Organize Botswana & Zimbabwe;x;
organize_botswana_and_zimbabwe_desc;After the recent conquest of Botswana & Zimbabwe, we can now organize the colony to establish cores of civilized countries in the territory and remove the unnecessary uncivilized countries that previously inhabited these lands... \n \n We must not forget that this decision is recommended by the organization of the entire continent...;x;
organize_mozambique_title;Organize Mozambique;x;
organize_mozambique_desc;After the recent conquest of Mozambique, we can now organize the colony to establish cores of civilized countries in the territory and remove the unnecessary uncivilized countries that previously inhabited these lands... \n \n We must not forget that this decision is recommended by the organization of the entire continent...;x;
organize_madagascar_title;Organize Madagascar;x;
organize_madagascar_desc;After the recent conquest of Madagascar, we can now organize the colony to establish cores of civilized countries in the territory and remove the unnecessary uncivilized countries that previously inhabited these lands... \n \n We must not forget that this decision is recommended by the organization of the entire continent...;x;
organize_morocco_title;Organize Morocco;x;
organize_morocco_desc;After the recent conquest of Morocco, we can now organize the colony to establish cores of civilized countries in the territory and remove the unnecessary uncivilized countries that previously inhabited these lands... \n \n We must not forget that this decision is recommended by the organization of the entire continent...;x;
organize_vietnam_n_laos_title;Organize Vietnam & Laos;x;
organize_vietnam_n_laos_desc;After the recent conquest of Indochina, we can now organize the colony to establish cores of civilized countries in the territory and remove the unnecessary uncivilized countries that previously inhabited these lands... \n \n We must not forget that this decision is recommended by the organization of the entire continent...;x;
buy_gold_coast_colonies_title;The Gold Coast Purchase;x;
buy_gold_coast_colonies_desc;Since the first European settlements in Europe, the Gold Coast has been one of the sites with the most colonial interest, which is why there have been many territorial changes in the area in the last century... However, our advisors believe that we can reach to an agreement with the countries in the area so that they give us the territories in exchange for economic compensation.;x;
conquest_of_the_sahara_title;Conquest of the Desert;x;
conquest_of_the_sahara_desc;After a series of agreements carried out in Europe over recent years that have led to the expansion of the countries of the continent towards new colonies. Our nation must prevail over time as an important power and that is why we must expand towards the Sahara desert, creating new protectorates...;x;
kinshasa_treaty_title;The River Congo Expedition;x;
kinshasa_treaty_desc;After decades searching for a colony, we have settled firmly in the Congo... Now by orders of Leopold II, we must declare the Congo Free State in the area, under his complete and indisputable mandate. The region will be governed solely by the monarch and blockades will be imposed on trade with Europe from the Congo. Long live Leopold II!;x;
lunda_treaty_title;The Tanganyika Lake Expedition;x;
lunda_treaty_desc;Since our expedition to the Congo River, our explorers believe that there is a lake at the end of the river that would mark the end of the Belgian Congo... We must find that river before another power does so and appropriates it, we must act.;x;
build_the_titanic_title;Build The Titanic;x;
build_the_titanic_desc;The great powers have lately been improving their ships to the point of creating ships that are almost impossible to shoot down naturally. To demonstrate our maritime power we must develop the best passenger ship built to date to demonstrate our hegemony on the seas... This new and indestructible ship will be named "R.M.S. Titanic".;x;
knigths_golden_circle_title;Knights of the Golden Circle;x;
knigths_golden_circle_desc;Since our independence from The United States of America, we've founded the company of the K.O.T.G.C that was the principal cassus belli for the American Civil War. Now that we are safely independent, our high government charges such as George W. l. Bikley were demanding us some changes in the country... We've also talked with our army commanders to give them reasons to support us in this reform over the country. We think it's the time to become a new and better nation...;x;
the_nicholas_reforms_title;The Nicholas II Reforms;x;
the_nicholas_reforms_desc;The reign of Nicholas II has only recently begun, so it was to be expected that he would one day try to implement some reforms to the country... \nThe first of them begins with the change of the flag to one that better represents the Russian people and state. Apart from that, the Russian council has approved the establishment of an authoritarian monarchy that will improve the stability of the country...;x;
viceregal_lands_title;The Viceregal Lands;x;
viceregal_lands_desc;After our recent conquest of some parts of the American continent, we can now give their rightful lands to the Spanish Viceroyalties;x;
tanzimat_education_ref_title;Tanzimat: Education Reform;x;
tanzimat_education_ref_desc;The Tanzimat reforms are important for the survival and modernization of our country, so we must undertake a series of progressive reforms in order to make effective changes in our nation... With the educational reform, we will improve the teaching capacity in our educational centers.;x;
tanzimat_army_ref_title;Tanzimat: Army Reform;x;
tanzimat_army_ref_desc;The Tanzimat reforms are important for the survival of our country and its modernization, so we must undertake a series of progressive reforms in order to make effective changes in our nation... With military reform, we will achieve an increase in efficiency in the armies.;x;
tanzimat_bureaucracy_ref_title;Tanzimat: Bureaucracy Reform;x;
tanzimat_bureaucracy_ref_desc;The Tanzimat reforms are important for the survival and modernization of our country, so we must undertake a series of progressive reforms in order to make effective changes in our nation... With bureaucratic reform, we will achieve a clear improvement in the management of territory and wealth.;x;
ruler_of_balkan_title;Ruler of The Balkans;x;
ruler_of_balkan_desc;A few years ago we reunited the Byzantine Empire and, together with it, many peoples separated for centuries were reunited... Now that the situation is better, we can claim former territories of the new Empire. This is the case of the Balkans, which were an important and extensive area of our nation.;x;
ruler_of_ankara_title;Ruler of Ankara;x;
ruler_of_ankara_desc;A few years ago we reunited the Byzantine Empire and, together with it, many peoples separated for centuries were reunited... Now that the situation is better, we can claim former territories of the new Empire. This is the case of the Anatolian peninsula, a large amount of territory that is located near our precious capital.;x;
ruler_of_east_title;Ruler of The East;x;
ruler_of_east_desc;After some aggressive conquests against the Ottoman Empire, we have decided that it must disappear... So we must reclaim all the territories that this nation has in its possession to prevent a power surge at the hands of this failed Muslim country. Glory to the Byzantine Empire!;x;